{"schema_version":1,"id":"TTR-E09-S11","type":"story","kind":"docs","project_id":"TTR","parent_id":"TTR-E09","title":"Add .github/FUNDING.yml (GitHub Sponsors button)","description":"Add .github/FUNDING.yml so the Sponsor button appears on the public repo page. Requires a GitHub Sponsors profile to be set up first. One-liner: github: mandarnilange. Deferred until the repo is public and the Sponsors sign-up is complete.","status":"backlog","priority":"low","created_at":"2026-05-12T14:40:17.860003Z","created_by":"mandar","created_by_role":"human","updated_at":"2026-05-12T14:40:17.860003Z","version":1,"impact":{},"acceptance_criteria":["File exists at .github/FUNDING.yml","GitHub Sponsors profile is live at github.com/sponsors/mandarnilange","Sponsor button visible on the public repo page"]}