{"schema_version":1,"id":"TTR-E01","type":"epic","project_id":"TTR","parent_id":"TTR","title":"Phase 1 — Core MVP","description":"Item domain (struct, validation, status enum), ID parsing/generation, Store interface, fsstore adapter, usecase + cli for init, add, list, show, update, done, delete (soft).","status":"done","deliverable":"Single-user backlog: init, add a project/epic/story/subtask, list, show, update, done, soft-delete all work end-to-end. Coverage thresholds active (≥90% domain / ≥85% usecase).","created_at":"2026-05-06T07:41:39.193307Z","created_by":"mandar","created_by_role":"human","updated_at":"2026-05-06T07:41:39.193307Z","completed_at":"2026-05-05T08:31:20Z","version":1,"impact":{}}