{"schema_version":1,"id":"TTR-E07-S09","type":"story","kind":"feature","project_id":"TTR","parent_id":"TTR-E07","title":"Two-repo + bare middle E2E (planner-executor) (CRITICAL PATH)","status":"done","priority":"critical","required_capabilities":["go","git"],"created_at":"2026-05-06T07:41:39.193307Z","created_by":"mandar","created_by_role":"human","updated_at":"2026-05-06T07:41:39.193307Z","completed_at":"2026-05-06T06:17:58Z","version":1,"impact":{"files":["test/e2e/git_sync_test.go"],"estimated_hours":5},"dependencies":["TTR-E07-S02","TTR-E07-S05"],"acceptance_criteria":["Two temp repos pointed at a third bare repo.","Planner imports 20 tasks; pushes.","Executor pulls; claims, completes 20 items.","Planner pulls and sees 20 done.","make ci green; v1.0 cut."]}