{"schema_version":1,"id":"TTR-E01-S07","type":"story","kind":"feature","project_id":"TTR","parent_id":"TTR-E01","title":"testfakes.Store implementing domain.Store (in-memory)","status":"done","priority":"high","required_capabilities":["go"],"created_at":"2026-05-06T07:41:39.193307Z","created_by":"mandar","created_by_role":"human","updated_at":"2026-05-06T07:41:39.193307Z","completed_at":"2026-05-05T07:46:14Z","version":1,"impact":{"files":["internal/usecase/testfakes/store.go","internal/usecase/testfakes/store_test.go"],"estimated_hours":3},"dependencies":["TTR-E01-S06"],"acceptance_criteria":["FakeStore stores items in a sync.Mutex-protected map.","Put persists exactly the Item the caller supplied — version, updated_at, and all other fields. The store does NOT mutate Version or UpdatedAt; usecases own time and version intent.","Put with expectVersion \u003e= 0 compares against the on-disk version and returns ErrVersionConflict on mismatch without writing.","Get returns ErrNotFound for unknown ids.","List honors every ListFilter field.","Self-tests cover every behavior so usecase tests can rely on the fake."]}