{"schema_version":1,"id":"TTR-E04-S11","type":"story","kind":"feature","project_id":"TTR","parent_id":"TTR-E04","title":"Move/Rename idempotency property test","status":"done","priority":"medium","required_capabilities":["go","rapid"],"created_at":"2026-05-06T07:41:39.193307Z","created_by":"mandar","created_by_role":"human","updated_at":"2026-05-06T07:41:39.193307Z","completed_at":"2026-05-06T01:11:05Z","version":1,"impact":{"files":["test/property/move_property_test.go"],"estimated_hours":2},"dependencies":["TTR-E04-S04","TTR-E04-S05"],"acceptance_criteria":["rapid generates random valid hierarchies; move/rename + recover yields the same state regardless of crash injection.","Aliases preserve old-id resolvability."]}