{"schema_version":1,"id":"TTR-E02-S08","type":"story","kind":"feature","project_id":"TTR","parent_id":"TTR-E02","title":"usecase.Tree (hierarchical view)","status":"done","priority":"medium","required_capabilities":["go"],"created_at":"2026-05-06T07:41:39.193307Z","created_by":"mandar","created_by_role":"human","updated_at":"2026-05-06T07:41:39.193307Z","completed_at":"2026-05-05T11:31:02Z","version":1,"impact":{"files":["internal/usecase/tree.go","internal/usecase/tree_test.go"],"estimated_hours":2},"dependencies":["TTR-E02-S01","TTR-E02-S07"],"acceptance_criteria":["Builds a tree from the index; honors --max-depth and --status filters.","Each node carries its full item plus children: [].","Empty workspace yields { roots: [] } with exit 0."]}