{"schema_version":1,"id":"TTR-E07-S05","type":"story","kind":"feature","project_id":"TTR","parent_id":"TTR-E07","title":"usecase.Import (native + phases-and-tasks formats)","status":"done","priority":"high","required_capabilities":["go"],"created_at":"2026-05-06T07:41:39.193307Z","created_by":"mandar","created_by_role":"human","updated_at":"2026-05-06T07:41:39.193307Z","completed_at":"2026-05-06T06:17:58Z","version":1,"impact":{"files":["internal/usecase/import.go","internal/usecase/import_test.go"],"estimated_hours":5},"dependencies":["TTR-E01-S11","TTR-E04-S03"],"acceptance_criteria":["Both formats per §15.2: native (array of full items) and phases-and-tasks (AgentForge-style).","Phases-and-tasks accepts the §15.2 minimum field set (id, title, description, type, priority, estimatedHours, files, acceptanceCriteria) AND the §5 native Item fields used by the dogfood tracker (kind, required_capabilities, dependencies, status, completed_at). Each maps directly to its Item counterpart when the task becomes a story; no field outside §5 is permitted.","Top-level critical_path on the import doc populates config.json:critical_path on the target workspace (§5.1).","--dry-run validates and reports without writing.","Atomic via OpLog: nothing written if any item invalid (returns ErrSchemaInvalid).","Self-test: imports .spec/tasks.json (the dogfood case) into a temp workspace and asserts 100 stories appear with their status, completed_at, dependencies, and required_capabilities preserved."]}