{"schema_version":1,"id":"TTR-E03-S03","type":"story","kind":"feature","project_id":"TTR","parent_id":"TTR-E03","title":"domain.Lease validity logic + tests","status":"done","priority":"high","required_capabilities":["go"],"created_at":"2026-05-06T07:41:39.193307Z","created_by":"mandar","created_by_role":"human","updated_at":"2026-05-06T07:41:39.193307Z","completed_at":"2026-05-05T11:31:07Z","version":1,"impact":{"files":["internal/domain/lease.go","internal/domain/lease_test.go"],"estimated_hours":2},"dependencies":["TTR-E01-S01"],"acceptance_criteria":["IsExpired(claim, now, skew) compares now \u003e expires_at + skew.","Default skew tolerance is 5 minutes per §6 Layer 3.","MatchesLeaseID(claim, leaseID) — guard for §14.3 ErrLeaseMismatch.","Tests cover boundary cases including exact-tie equality."]}