{"schema_version":1,"id":"TTR-E01-S15","type":"story","kind":"feature","project_id":"TTR","parent_id":"TTR-E01","title":"usecase.Done (status=done, completed_at=now)","status":"done","priority":"high","required_capabilities":["go"],"created_at":"2026-05-06T07:41:39.193307Z","created_by":"mandar","created_by_role":"human","updated_at":"2026-05-06T07:41:39.193307Z","completed_at":"2026-05-05T08:12:51Z","version":1,"impact":{"files":["internal/usecase/done.go","internal/usecase/done_test.go"],"estimated_hours":2},"dependencies":["TTR-E01-S07"],"acceptance_criteria":["Usecase sets Item.Status = done, Item.CompletedAt = clock.Now(), Item.UpdatedAt = clock.Now(), Item.Version = old.Version + 1 before calling Store.Put. The store never touches time or version.","Optional --note appends a journal entry with event=completed (entry timestamp also from the injected clock).","Lease enforcement deferred to Phase 3; Phase 1 ignores --lease-id."]}