{"schema_version":1,"id":"TTR-E07-S03","type":"story","kind":"feature","project_id":"TTR","parent_id":"TTR-E07","title":"usecase.Merge with deterministic claim-conflict resolution (lower lease_id wins)","status":"done","priority":"high","required_capabilities":["go"],"created_at":"2026-05-06T07:41:39.193307Z","created_by":"mandar","created_by_role":"human","updated_at":"2026-05-06T07:41:39.193307Z","completed_at":"2026-05-06T06:17:58Z","version":1,"impact":{"files":["internal/usecase/merge.go","internal/usecase/merge_test.go"],"estimated_hours":5},"dependencies":["TTR-E07-S01"],"acceptance_criteria":["Per-task JSON conflicts resolved deterministically.","Claim conflicts: lower lease_id wins (§6 Layer 8); the loser sees ErrClaimLost on next operation.","Records claim_lost event in events shard."]}