{"schema_version":1,"id":"TTR-E02-S11","type":"story","kind":"feature","project_id":"TTR","parent_id":"TTR-E02","title":"usecase.Summary (rollups + critical_path + deliverables)","status":"done","priority":"medium","required_capabilities":["go"],"created_at":"2026-05-06T07:41:39.193307Z","created_by":"mandar","created_by_role":"human","updated_at":"2026-05-06T07:41:39.193307Z","completed_at":"2026-05-05T11:31:03Z","version":1,"impact":{"files":["internal/usecase/summary.go","internal/usecase/summary_test.go"],"estimated_hours":3},"dependencies":["TTR-E02-S07"],"acceptance_criteria":["Output exactly per §15.2: totals, by_\u003cfield\u003e, critical_path (with next field), deliverables.","Group-by --by field: type|status|kind|priority|assignee|project|epic.","Reads from the index, not from items/, so the call is cheap."]}