{"schema_version":1,"id":"TTR-E05-S02","type":"story","kind":"feature","project_id":"TTR","parent_id":"TTR-E05","title":"domain.EventFilter matcher (multi-flag AND, CSV value OR)","status":"done","priority":"high","required_capabilities":["go"],"created_at":"2026-05-06T07:41:39.193307Z","created_by":"mandar","created_by_role":"human","updated_at":"2026-05-06T07:41:39.193307Z","completed_at":"2026-05-06T02:49:04Z","version":1,"impact":{"files":["internal/domain/event_filter.go","internal/domain/event_filter_test.go"],"estimated_hours":2},"dependencies":["TTR-E02-S04"],"acceptance_criteria":["Matches event, actor, id, from, to, op_id with AND between flags and OR within CSV values.","--id RKN-E01 matches descendants RKN-E01-S03 and RKN-E01-S03-T02.","Table-driven tests cover every field plus the prefix-id case."]}