{"schema_version":1,"id":"TTR-E02-S05","type":"story","kind":"feature","project_id":"TTR","parent_id":"TTR-E02","title":"adapter/eventlog (sharded JSONL append + read)","status":"done","priority":"high","required_capabilities":["go"],"created_at":"2026-05-06T07:41:39.193307Z","created_by":"mandar","created_by_role":"human","updated_at":"2026-05-06T07:41:39.193307Z","completed_at":"2026-05-05T11:31:02Z","version":1,"impact":{"files":["internal/adapter/eventlog/log.go","internal/adapter/eventlog/log_test.go"],"estimated_hours":4},"dependencies":["TTR-E02-S04"],"acceptance_criteria":["Daily-sharded files: .tasks/events/\u003cYYYY-MM-DD\u003e.jsonl (§6 Layer 5).","Append uses O_APPEND with line-atomic writes (one event per line, ≤4KiB).","Read iterates shards in date order, applies filter, sorts within shard by ts.","EventFilter.IDPrefix matches both the exact id and descendants (RKN-E01 matches RKN-E01-S03)."]}