{"schema_version":1,"id":"TTR-E05-S05","type":"story","kind":"feature","project_id":"TTR","parent_id":"TTR-E05","title":"usecase.Done extension with --metadata","status":"done","priority":"medium","required_capabilities":["go"],"created_at":"2026-05-06T07:41:39.193307Z","created_by":"mandar","created_by_role":"human","updated_at":"2026-05-06T07:41:39.193307Z","completed_at":"2026-05-06T02:49:04Z","version":1,"impact":{"files":["internal/usecase/done.go","internal/usecase/done_test.go"],"estimated_hours":1},"dependencies":["TTR-E03-S08"],"acceptance_criteria":["--metadata JSON attached to the journal entry.","Schema is unconstrained per §5; tool stores and surfaces, never validates keys.","Tests cover --metadata and --metadata-file."]}