{"schema_version":1,"id":"TTR-E03-S01","type":"story","kind":"feature","project_id":"TTR","parent_id":"TTR-E03","title":"adapter/idgen ULID generator + testfakes.SeqIDGen","status":"done","priority":"high","required_capabilities":["go","ulid"],"created_at":"2026-05-06T07:41:39.193307Z","created_by":"mandar","created_by_role":"human","updated_at":"2026-05-06T07:41:39.193307Z","completed_at":"2026-05-05T11:31:07Z","version":1,"impact":{"files":["internal/adapter/idgen/ulid.go","internal/adapter/idgen/ulid_test.go","internal/usecase/testfakes/idgen.go"],"estimated_hours":1.5},"dependencies":["TTR-E01-S06"],"acceptance_criteria":["Real impl uses oklog/ulid/v2 with a monotonic entropy source.","FakeIDGen returns IDs from an injected sequence so tests are deterministic.","Generated ULIDs are sortable and length 26."]}