{"schema_version":1,"id":"TTR-E03-S13","type":"story","kind":"feature","project_id":"TTR","parent_id":"TTR-E03","title":"claim contention concurrent test (1000 iterations × N goroutines)","status":"done","priority":"high","required_capabilities":["go"],"created_at":"2026-05-06T07:41:39.193307Z","created_by":"mandar","created_by_role":"human","updated_at":"2026-05-06T07:41:39.193307Z","completed_at":"2026-05-05T11:31:08Z","version":1,"impact":{"files":["internal/usecase/claim_concurrent_test.go"],"estimated_hours":3},"dependencies":["TTR-E03-S05"],"acceptance_criteria":["1000 iterations × N goroutines call Claim on the same item; exactly one succeeds per iteration; others receive ErrAlreadyClaimed.","All under -race -count=10."]}