{"schema_version":1,"id":"TTR-E07-S08","type":"story","kind":"feature","project_id":"TTR","parent_id":"TTR-E07","title":"task sync --watch (explicit long-running sync loop)","status":"done","priority":"medium","required_capabilities":["go"],"created_at":"2026-05-06T07:41:39.193307Z","created_by":"mandar","created_by_role":"human","updated_at":"2026-05-06T07:41:39.193307Z","completed_at":"2026-05-06T06:17:58Z","version":1,"impact":{"files":["internal/cli/sync.go","internal/cli/sync_test.go","internal/usecase/sync.go"],"estimated_hours":3},"dependencies":["TTR-E07-S02"],"acceptance_criteria":["task sync without --watch is a one-shot pull/push and exits (default behavior already from TTR-E07-S02).","task sync --watch is an explicit long-running command that loops every config.json:git.auto_sync_seconds (or the --interval override) until ctx is cancelled (Ctrl+C). Exits 0 on clean shutdown, 130 on SIGINT.","Rejected as ErrUsage if config.json:git.auto_sync_seconds is null AND --interval is not given.","Tested via context cancellation: the loop exits cleanly within one tick of cancellation.","Avoids the conceptual flaw of trying to run a background goroutine inside a one-shot CLI invocation that would otherwise exit immediately."]}