{"schema_version":1,"id":"TTR-E04-S03","type":"story","kind":"feature","project_id":"TTR","parent_id":"TTR-E04","title":"adapter/oplog (Begin/MarkStep/Complete/Pending)","status":"done","priority":"high","required_capabilities":["go","posix"],"created_at":"2026-05-06T07:41:39.193307Z","created_by":"mandar","created_by_role":"human","updated_at":"2026-05-06T07:41:39.193307Z","completed_at":"2026-05-06T01:11:04Z","version":1,"impact":{"files":["internal/adapter/oplog/oplog.go","internal/adapter/oplog/oplog_test.go"],"estimated_hours":4},"dependencies":["TTR-E04-S02"],"acceptance_criteria":["Operation files at .tasks/operations/\u003cop-id\u003e.json (gitignored).","Begin writes intent atomically; MarkStep updates done flags; Complete flips status to completed and schedules grace-period deletion.","Pending returns operations in pending|executing state."]}