{"schema_version":1,"id":"TTR-E03-S10","type":"story","kind":"feature","project_id":"TTR","parent_id":"TTR-E03","title":"usecase.Next (filters + critical-path bonus + tie-breakers + --auto-claim)","status":"done","priority":"high","required_capabilities":["go"],"created_at":"2026-05-06T07:41:39.193307Z","created_by":"mandar","created_by_role":"human","updated_at":"2026-05-06T07:41:39.193307Z","completed_at":"2026-05-05T11:31:07Z","version":1,"impact":{"files":["internal/usecase/next.go","internal/usecase/next_test.go"],"estimated_hours":5},"dependencies":["TTR-E03-S05","TTR-E03-S09","TTR-E02-S01","TTR-E01-S04"],"acceptance_criteria":["Loads workspace.json via WorkspaceLoader (TTR-E01-S04) for critical_path; loads local.json (with env-var overrides) via LocalLoader for default_agent and agent_capabilities; --match-capabilities filters to items whose required_capabilities ⊆ effective capabilities.","Selection per §15.2: filter, drop unmet deps, critical-path bonus, sort by priority desc → critical-path order asc → due_date asc → updated_at asc → id asc.","--max-hours filters by estimated_hours.","--affinity boosts items where agent appears in past journal actor.","--auto-claim atomically claims the chosen item; race losers see ErrAlreadyClaimed and re-pick on retry.","Sort comparator is unit-tested with a permutation matrix that exercises every tie-breaker independently: nil due_date vs set due_date (nils sort last), equal priority forcing critical-path-order resolution, missing critical-path entry, equal updated_at forcing id resolution, and the all-equal case (deterministic id order). The test asserts no panic and a stable, totally-ordered result for ≥50 generated permutations."]}