{"schema_version":1,"id":"TTR-E09-S08","type":"story","kind":"docs","project_id":"TTR","parent_id":"TTR-E09","title":"OSS-ready: contributing docs, security, code of conduct, issue/PR templates","description":"LICENSE (MIT) is already in the repo. The rest of the open-source-readiness scaffolding is not. Add the missing files so the project is recognisable to GitHub's community standards check (https://github.com/\u003cowner\u003e/\u003crepo\u003e/community) and to first-time contributors arriving cold:\\n\\n- CONTRIBUTING.md — how to set up, the TDD requirement (CLAUDE.md §3), the make ci gate, conventional commits (§11.6), branch naming, signing off.\\n- CODE_OF_CONDUCT.md — Contributor Covenant v2.1 boilerplate.\\n- SECURITY.md — how to report vulnerabilities privately; preferred contact channel (e-mail or GitHub private vulnerability reporting).\\n- CHANGELOG.md — keep-a-changelog format. Backfill v1.0.0 / v1.x rows from the existing release notes.\\n- .github/ISSUE_TEMPLATE/{bug_report,feature_request}.md — structured fields for repro / expected / actual / version / OS, plus a 'spec-mismatch' template that links to docs/spec-questions.md.\\n- .github/PULL_REQUEST_TEMPLATE.md — checklist for tests / coverage / story-id reference / CHANGELOG entry / docs.\\n- README badge audit — confirm CI, Go reference, license badges all point at the right org/repo when the project moves to its public home.\\n- README 'Contributing' section — short paragraph linking to CONTRIBUTING.md.\\n- (Optional but cheap) .github/FUNDING.yml — empty or GitHub Sponsors placeholder so the sponsor button works.","status":"done","priority":"medium","created_at":"2026-05-12T11:42:10.67221Z","created_by":"mandar","created_by_role":"human","updated_at":"2026-05-12T14:42:10.863532Z","completed_at":"2026-05-12T14:42:10.863532Z","version":5,"impact":{},"acceptance_criteria":["GitHub community-standards page reports 'All checks complete' once pushed","CONTRIBUTING.md documents the make ci gate and TDD requirement and links the spec","CODE_OF_CONDUCT.md uses Contributor Covenant 2.1","SECURITY.md states the disclosure channel and response SLA","Issue + PR templates exist; CHANGELOG.md backfilled to v1.0.0","Public URL of the repo agreed upon; README badges + LICENSE copyright reviewed"],"journal":[{"ts":"2026-05-12T14:08:52.727362Z","actor":"mandar","event":"updated","note":"starting OSS-readiness scaffolding"},{"ts":"2026-05-12T14:08:57.451217Z","actor":"mandar","event":"claimed","metadata":{"lease_id":"01KRE89YKBDNMFSAFHVQ5T3YRF","ttl_seconds":3600}},{"ts":"2026-05-12T14:09:05.619673Z","actor":"mandar","event":"updated","note":"writing OSS scaffolding files"},{"ts":"2026-05-12T14:42:10.863532Z","actor":"mandar","event":"completed","note":"All OSS scaffolding files created: CODE_OF_CONDUCT.md, SECURITY.md, CHANGELOG.md (unreleased), .github/ISSUE_TEMPLATE/{bug_report,feature_request,spec_mismatch}.md, .github/PULL_REQUEST_TEMPLATE.md. README Contributing section updated with CONTRIBUTING.md link. FUNDING.yml deferred to TTR-E09-S11."}]}