{"schema_version":1,"id":"TTR-E04-S08","type":"story","kind":"feature","project_id":"TTR","parent_id":"TTR-E04","title":"usecase.Recover (roll forward orphaned ops) (CRITICAL PATH)","status":"done","priority":"critical","required_capabilities":["go"],"created_at":"2026-05-06T07:41:39.193307Z","created_by":"mandar","created_by_role":"human","updated_at":"2026-05-06T07:41:39.193307Z","completed_at":"2026-05-06T01:11:05Z","version":1,"impact":{"files":["internal/usecase/recover.go","internal/usecase/recover_test.go"],"estimated_hours":5},"dependencies":["TTR-E04-S03"],"acceptance_criteria":["Reads OpLog.Pending; for each, resumes from the next undone step (§6 Layer 6).","Auto-invoked by task list/task next when an in-flight op is detected.","Failed recovery surfaces in task validate.","Output: { recovered: [{ op_id, kind, steps_completed, steps_skipped }], failed: [...] }."]}