{"schema_version":1,"id":"TTR-E08-S03","type":"story","kind":"feature","project_id":"TTR","parent_id":"TTR-E08","title":"Shell hook emission (.tasks/hooks/*.sh)","status":"done","priority":"medium","required_capabilities":["go","bash"],"created_at":"2026-05-06T07:41:39.193307Z","created_by":"mandar","created_by_role":"human","updated_at":"2026-05-06T07:41:39.193307Z","completed_at":"2026-05-06T06:17:58Z","version":1,"impact":{"files":["internal/usecase/shell_hooks.go","internal/usecase/shell_hooks_test.go"],"estimated_hours":2},"dependencies":["TTR-E02-S05"],"acceptance_criteria":["On each lifecycle event, run the matching shell script under .tasks/hooks/ if executable.","Event JSON piped on stdin; non-zero exit logged but ignored.","Sample on-status-change.sh in test fixtures."]}