{"schema_version":1,"id":"TTR-E08-S05","type":"story","kind":"feature","project_id":"TTR","parent_id":"TTR-E08","title":"usecase.Compact (squash events, archive shards, prune ops, gc aliases)","status":"done","priority":"low","required_capabilities":["go"],"created_at":"2026-05-06T07:41:39.193307Z","created_by":"mandar","created_by_role":"human","updated_at":"2026-05-06T07:41:39.193307Z","completed_at":"2026-05-06T06:17:59Z","version":1,"impact":{"files":["internal/usecase/compact.go","internal/usecase/compact_test.go"],"estimated_hours":4},"dependencies":["TTR-E02-S05","TTR-E04-S03"],"acceptance_criteria":["Default cutoff: 90 days.","Squashes events into item state; archives or deletes old daily shards; prunes resolved op files; gc's stale aliases.","Idempotent.","Returns { shards_archived, ops_pruned, aliases_pruned, bytes_saved } per §15.2."]}